Column,Original_Text,Tokenized_Sentences,Tokenized_Words
Answer,"To maintain a high concentration of sodium outside the cell and potassium inside the cell, using ATP.","['To maintain a high concentration of sodium outside the cell and potassium inside the cell, using ATP.']","['To', 'maintain', 'a', 'high', 'concentration', 'of', 'sodium', 'outside', 'the', 'cell', 'and', 'potassium', 'inside', 'the', 'cell', ',', 'using', 'ATP', '.']"
Answer,"A dehydration reaction removes a water molecule, linking the amino acids.","['A dehydration reaction removes a water molecule, linking the amino acids.']","['A', 'dehydration', 'reaction', 'removes', 'a', 'water', 'molecule', ',', 'linking', 'the', 'amino', 'acids', '.']"
Answer,"It provides structural support, aids in cell movement, and helps with intracellular transport.","['It provides structural support, aids in cell movement, and helps with intracellular transport.']","['It', 'provides', 'structural', 'support', ',', 'aids', 'in', 'cell', 'movement', ',', 'and', 'helps', 'with', 'intracellular', 'transport', '.']"
Answer,It helps maintain membrane fluidity by preventing phospholipids from packing too closely together.,['It helps maintain membrane fluidity by preventing phospholipids from packing too closely together.'],"['It', 'helps', 'maintain', 'membrane', 'fluidity', 'by', 'preventing', 'phospholipids', 'from', 'packing', 'too', 'closely', 'together', '.']"
Answer,"It separates the contents of the nucleus from the cytoplasm, regulating material exchange.","['It separates the contents of the nucleus from the cytoplasm, regulating material exchange.']","['It', 'separates', 'the', 'contents', 'of', 'the', 'nucleus', 'from', 'the', 'cytoplasm', ',', 'regulating', 'material', 'exchange', '.']"
Answer,"DNA is transcribed into RNA, which is translated into protein.","['DNA is transcribed into RNA, which is translated into protein.']","['DNA', 'is', 'transcribed', 'into', 'RNA', ',', 'which', 'is', 'translated', 'into', 'protein', '.']"
Answer,They form the spindle apparatus that helps separate chromosomes during mitosis.,['They form the spindle apparatus that helps separate chromosomes during mitosis.'],"['They', 'form', 'the', 'spindle', 'apparatus', 'that', 'helps', 'separate', 'chromosomes', 'during', 'mitosis', '.']"
Answer,"Molecules move from areas of high concentration to areas of low concentration, down the gradient.","['Molecules move from areas of high concentration to areas of low concentration, down the gradient.']","['Molecules', 'move', 'from', 'areas', 'of', 'high', 'concentration', 'to', 'areas', 'of', 'low', 'concentration', ',', 'down', 'the', 'gradient', '.']"
Answer,"It stores water, nutrients, and waste products and helps maintain turgor pressure.","['It stores water, nutrients, and waste products and helps maintain turgor pressure.']","['It', 'stores', 'water', ',', 'nutrients', ',', 'and', 'waste', 'products', 'and', 'helps', 'maintain', 'turgor', 'pressure', '.']"
Answer,"They connect the ECM to the cytoskeleton, helping cells adhere to their environment.","['They connect the ECM to the cytoskeleton, helping cells adhere to their environment.']","['They', 'connect', 'the', 'ECM', 'to', 'the', 'cytoskeleton', ',', 'helping', 'cells', 'adhere', 'to', 'their', 'environment', '.']"
Answer,Ribosomes translate mRNA into amino acid sequences to form proteins.,['Ribosomes translate mRNA into amino acid sequences to form proteins.'],"['Ribosomes', 'translate', 'mRNA', 'into', 'amino', 'acid', 'sequences', 'to', 'form', 'proteins', '.']"
Answer,"Hydrolysis, where water is added to break bonds.","['Hydrolysis, where water is added to break bonds.']","['Hydrolysis', ',', 'where', 'water', 'is', 'added', 'to', 'break', 'bonds', '.']"
Answer,"The double helix provides stability, and complementary base pairing allows for accurate replication.","['The double helix provides stability, and complementary base pairing allows for accurate replication.']","['The', 'double', 'helix', 'provides', 'stability', ',', 'and', 'complementary', 'base', 'pairing', 'allows', 'for', 'accurate', 'replication', '.']"
Answer,It adds carbohydrate groups to form glycoproteins or lipids to form glycolipids.,['It adds carbohydrate groups to form glycoproteins or lipids to form glycolipids.'],"['It', 'adds', 'carbohydrate', 'groups', 'to', 'form', 'glycoproteins', 'or', 'lipids', 'to', 'form', 'glycolipids', '.']"
Answer,The rough ER is involved in the synthesis and modification of proteins.,['The rough ER is involved in the synthesis and modification of proteins.'],"['The', 'rough', 'ER', 'is', 'involved', 'in', 'the', 'synthesis', 'and', 'modification', 'of', 'proteins', '.']"
Answer,"Facilitated diffusion does not require energy, while active transport does.","['Facilitated diffusion does not require energy, while active transport does.']","['Facilitated', 'diffusion', 'does', 'not', 'require', 'energy', ',', 'while', 'active', 'transport', 'does', '.']"
Answer,The sequence of amino acids in the polypeptide chain.,['The sequence of amino acids in the polypeptide chain.'],"['The', 'sequence', 'of', 'amino', 'acids', 'in', 'the', 'polypeptide', 'chain', '.']"
Answer,"The enzyme's active site is specifically shaped to fit its substrate, like a lock and key.","[""The enzyme's active site is specifically shaped to fit its substrate, like a lock and key.""]","['The', 'enzyme', ""'s"", 'active', 'site', 'is', 'specifically', 'shaped', 'to', 'fit', 'its', 'substrate', ',', 'like', 'a', 'lock', 'and', 'key', '.']"
Answer,It helps form the structure of ribosomes and catalyzes protein synthesis.,['It helps form the structure of ribosomes and catalyzes protein synthesis.'],"['It', 'helps', 'form', 'the', 'structure', 'of', 'ribosomes', 'and', 'catalyzes', 'protein', 'synthesis', '.']"
Answer,It regulates the movement of molecules between the nucleus and the cytoplasm.,['It regulates the movement of molecules between the nucleus and the cytoplasm.'],"['It', 'regulates', 'the', 'movement', 'of', 'molecules', 'between', 'the', 'nucleus', 'and', 'the', 'cytoplasm', '.']"
Answer,"The enzyme's shape must fit its substrate, and it functions best within specific environmental conditions (e.g., pH, temperature).","[""The enzyme's shape must fit its substrate, and it functions best within specific environmental conditions (e.g., pH, temperature).""]","['The', 'enzyme', ""'s"", 'shape', 'must', 'fit', 'its', 'substrate', ',', 'and', 'it', 'functions', 'best', 'within', 'specific', 'environmental', 'conditions', '(', 'e.g.', ',', 'pH', ',', 'temperature', ')', '.']"
Answer,They provide a hydrophilic passageway through the membrane for ions to move along their concentration gradient.,['They provide a hydrophilic passageway through the membrane for ions to move along their concentration gradient.'],"['They', 'provide', 'a', 'hydrophilic', 'passageway', 'through', 'the', 'membrane', 'for', 'ions', 'to', 'move', 'along', 'their', 'concentration', 'gradient', '.']"
Answer,Covalent bonds are stronger because they involve the sharing of electrons.,['Covalent bonds are stronger because they involve the sharing of electrons.'],"['Covalent', 'bonds', 'are', 'stronger', 'because', 'they', 'involve', 'the', 'sharing', 'of', 'electrons', '.']"
Answer,"To absorb light energy, primarily in the blue and red wavelengths, for use in photosynthesis.","['To absorb light energy, primarily in the blue and red wavelengths, for use in photosynthesis.']","['To', 'absorb', 'light', 'energy', ',', 'primarily', 'in', 'the', 'blue', 'and', 'red', 'wavelengths', ',', 'for', 'use', 'in', 'photosynthesis', '.']"
Answer,"Guard cells change shape based on water availability, controlling the stomatal pores.","['Guard cells change shape based on water availability, controlling the stomatal pores.']","['Guard', 'cells', 'change', 'shape', 'based', 'on', 'water', 'availability', ',', 'controlling', 'the', 'stomatal', 'pores', '.']"
Answer,"Saturated fatty acids lack double bonds, making them straight, while unsaturated fatty acids have one or more double bonds, creating kinks.","['Saturated fatty acids lack double bonds, making them straight, while unsaturated fatty acids have one or more double bonds, creating kinks.']","['Saturated', 'fatty', 'acids', 'lack', 'double', 'bonds', ',', 'making', 'them', 'straight', ',', 'while', 'unsaturated', 'fatty', 'acids', 'have', 'one', 'or', 'more', 'double', 'bonds', ',', 'creating', 'kinks', '.']"
Answer,They have hydrophilic heads and hydrophobic tails.,['They have hydrophilic heads and hydrophobic tails.'],"['They', 'have', 'hydrophilic', 'heads', 'and', 'hydrophobic', 'tails', '.']"
Answer,Hydrogen bonds.,['Hydrogen bonds.'],"['Hydrogen', 'bonds', '.']"
Answer,"Extreme pH levels can denature the enzyme, altering its active site.","['Extreme pH levels can denature the enzyme, altering its active site.']","['Extreme', 'pH', 'levels', 'can', 'denature', 'the', 'enzyme', ',', 'altering', 'its', 'active', 'site', '.']"
Answer,Cohesion and adhesion.,['Cohesion and adhesion.'],"['Cohesion', 'and', 'adhesion', '.']"
Answer,It minimizes changes in pH by absorbing or donating hydrogen ions.,['It minimizes changes in pH by absorbing or donating hydrogen ions.'],"['It', 'minimizes', 'changes', 'in', 'pH', 'by', 'absorbing', 'or', 'donating', 'hydrogen', 'ions', '.']"
Answer,They stabilize the tertiary structure by forming covalent bonds between cysteine residues.,['They stabilize the tertiary structure by forming covalent bonds between cysteine residues.'],"['They', 'stabilize', 'the', 'tertiary', 'structure', 'by', 'forming', 'covalent', 'bonds', 'between', 'cysteine', 'residues', '.']"
Answer,They can be used as tracers to study biochemical pathways.,['They can be used as tracers to study biochemical pathways.'],"['They', 'can', 'be', 'used', 'as', 'tracers', 'to', 'study', 'biochemical', 'pathways', '.']"
Answer,Its ability to form four covalent bonds.,['Its ability to form four covalent bonds.'],"['Its', 'ability', 'to', 'form', 'four', 'covalent', 'bonds', '.']"
Answer,"An alpha helix is coiled, while a beta sheet consists of folded strands connected by hydrogen bonds.","['An alpha helix is coiled, while a beta sheet consists of folded strands connected by hydrogen bonds.']","['An', 'alpha', 'helix', 'is', 'coiled', ',', 'while', 'a', 'beta', 'sheet', 'consists', 'of', 'folded', 'strands', 'connected', 'by', 'hydrogen', 'bonds', '.']"
Answer,Polar molecules and ions dissolve easily in water due to its polarity.,['Polar molecules and ions dissolve easily in water due to its polarity.'],"['Polar', 'molecules', 'and', 'ions', 'dissolve', 'easily', 'in', 'water', 'due', 'to', 'its', 'polarity', '.']"
Answer,Monomers are small units that join to form larger polymers through dehydration reactions.,['Monomers are small units that join to form larger polymers through dehydration reactions.'],"['Monomers', 'are', 'small', 'units', 'that', 'join', 'to', 'form', 'larger', 'polymers', 'through', 'dehydration', 'reactions', '.']"
Answer,Energy is released when the terminal phosphate bond is broken.,['Energy is released when the terminal phosphate bond is broken.'],"['Energy', 'is', 'released', 'when', 'the', 'terminal', 'phosphate', 'bond', 'is', 'broken', '.']"
Answer,Hydrogen bonding.,['Hydrogen bonding.'],"['Hydrogen', 'bonding', '.']"
Answer,The orientation of the hydroxyl group on carbon 1.,['The orientation of the hydroxyl group on carbon 1.'],"['The', 'orientation', 'of', 'the', 'hydroxyl', 'group', 'on', 'carbon', '1', '.']"
Answer,Dehydration synthesis removes water to form bonds; hydrolysis adds water to break bonds.,['Dehydration synthesis removes water to form bonds; hydrolysis adds water to break bonds.'],"['Dehydration', 'synthesis', 'removes', 'water', 'to', 'form', 'bonds', ';', 'hydrolysis', 'adds', 'water', 'to', 'break', 'bonds', '.']"
Answer,They cannot be synthesized by the body and must be obtained from food.,['They cannot be synthesized by the body and must be obtained from food.'],"['They', 'can', 'not', 'be', 'synthesized', 'by', 'the', 'body', 'and', 'must', 'be', 'obtained', 'from', 'food', '.']"
Answer,They assist in proper folding by providing a protected environment.,['They assist in proper folding by providing a protected environment.'],"['They', 'assist', 'in', 'proper', 'folding', 'by', 'providing', 'a', 'protected', 'environment', '.']"
Answer,They determine the molecule's chemical properties and reactions.,"[""They determine the molecule's chemical properties and reactions.""]","['They', 'determine', 'the', 'molecule', ""'s"", 'chemical', 'properties', 'and', 'reactions', '.']"
Answer,Hydrogen bonding creates a cohesive force at the surface.,['Hydrogen bonding creates a cohesive force at the surface.'],"['Hydrogen', 'bonding', 'creates', 'a', 'cohesive', 'force', 'at', 'the', 'surface', '.']"
Answer,"Polar bonds share electrons unequally, while nonpolar bonds share them equally.","['Polar bonds share electrons unequally, while nonpolar bonds share them equally.']","['Polar', 'bonds', 'share', 'electrons', 'unequally', ',', 'while', 'nonpolar', 'bonds', 'share', 'them', 'equally', '.']"
Answer,Unsaturated fatty acids prevent tight packing of phospholipids.,['Unsaturated fatty acids prevent tight packing of phospholipids.'],"['Unsaturated', 'fatty', 'acids', 'prevent', 'tight', 'packing', 'of', 'phospholipids', '.']"
Answer,They stabilize the double helix by holding complementary bases together.,['They stabilize the double helix by holding complementary bases together.'],"['They', 'stabilize', 'the', 'double', 'helix', 'by', 'holding', 'complementary', 'bases', 'together', '.']"
Answer,It connects monosaccharides in carbohydrates.,['It connects monosaccharides in carbohydrates.'],"['It', 'connects', 'monosaccharides', 'in', 'carbohydrates', '.']"
Answer,Its polarity allows it to dissolve many substances.,['Its polarity allows it to dissolve many substances.'],"['Its', 'polarity', 'allows', 'it', 'to', 'dissolve', 'many', 'substances', '.']"
Answer,To provide structural support in the cell wall.,['To provide structural support in the cell wall.'],"['To', 'provide', 'structural', 'support', 'in', 'the', 'cell', 'wall', '.']"
Answer,"It binds to a site other than the active site, changing the enzyme’s shape.","['It binds to a site other than the active site, changing the enzyme’s shape.']","['It', 'binds', 'to', 'a', 'site', 'other', 'than', 'the', 'active', 'site', ',', 'changing', 'the', 'enzyme', '’', 's', 'shape', '.']"
Answer,"RNA contains ribose sugar and uracil, while DNA contains deoxyribose and thymine.","['RNA contains ribose sugar and uracil, while DNA contains deoxyribose and thymine.']","['RNA', 'contains', 'ribose', 'sugar', 'and', 'uracil', ',', 'while', 'DNA', 'contains', 'deoxyribose', 'and', 'thymine', '.']"
Answer,It can form four covalent bonds with other atoms.,['It can form four covalent bonds with other atoms.'],"['It', 'can', 'form', 'four', 'covalent', 'bonds', 'with', 'other', 'atoms', '.']"
Answer,"It acts as a base, accepting hydrogen ions.","['It acts as a base, accepting hydrogen ions.']","['It', 'acts', 'as', 'a', 'base', ',', 'accepting', 'hydrogen', 'ions', '.']"
Answer,"They self-assemble into bilayers, with hydrophilic heads facing water and hydrophobic tails inward.","['They self-assemble into bilayers, with hydrophilic heads facing water and hydrophobic tails inward.']","['They', 'self-assemble', 'into', 'bilayers', ',', 'with', 'hydrophilic', 'heads', 'facing', 'water', 'and', 'hydrophobic', 'tails', 'inward', '.']"
Answer,They contribute to weak attractions between nonpolar molecules.,['They contribute to weak attractions between nonpolar molecules.'],"['They', 'contribute', 'to', 'weak', 'attractions', 'between', 'nonpolar', 'molecules', '.']"
Answer,They have different numbers of neutrons.,['They have different numbers of neutrons.'],"['They', 'have', 'different', 'numbers', 'of', 'neutrons', '.']"
Answer,To minimize disruption of hydrogen bonding among water molecules.,['To minimize disruption of hydrogen bonding among water molecules.'],"['To', 'minimize', 'disruption', 'of', 'hydrogen', 'bonding', 'among', 'water', 'molecules', '.']"
Answer,They play roles in cell recognition and signaling.,['They play roles in cell recognition and signaling.'],"['They', 'play', 'roles', 'in', 'cell', 'recognition', 'and', 'signaling', '.']"
Answer,Shape affects how molecules interact with specific receptors or enzymes.,['Shape affects how molecules interact with specific receptors or enzymes.'],"['Shape', 'affects', 'how', 'molecules', 'interact', 'with', 'specific', 'receptors', 'or', 'enzymes', '.']"
Answer,They are essential in small amounts for enzyme function and structure.,['They are essential in small amounts for enzyme function and structure.'],"['They', 'are', 'essential', 'in', 'small', 'amounts', 'for', 'enzyme', 'function', 'and', 'structure', '.']"
Answer,Their complexity allows them to perform functions not possible by individual monomers.,['Their complexity allows them to perform functions not possible by individual monomers.'],"['Their', 'complexity', 'allows', 'them', 'to', 'perform', 'functions', 'not', 'possible', 'by', 'individual', 'monomers', '.']"
Answer,"Infected bacteria cells contained significant amounts of radioactive phosphorus, but not radioactive sulfur.","['Infected bacteria cells contained significant amounts of radioactive phosphorus, but not radioactive sulfur.']","['Infected', 'bacteria', 'cells', 'contained', 'significant', 'amounts', 'of', 'radioactive', 'phosphorus', ',', 'but', 'not', 'radioactive', 'sulfur', '.']"
Answer,"How can the formation of covalent bonds between amino acids be blocked? 
",['How can the formation of covalent bonds between amino acids be blocked?'],"['How', 'can', 'the', 'formation', 'of', 'covalent', 'bonds', 'between', 'amino', 'acids', 'be', 'blocked', '?']"
Answer,"Cellulose is consumed as a linear polysaccharide and is broken down into glucose monosaccharides during digestion. ",['Cellulose is consumed as a linear polysaccharide and is broken down into glucose monosaccharides during digestion.'],"['Cellulose', 'is', 'consumed', 'as', 'a', 'linear', 'polysaccharide', 'and', 'is', 'broken', 'down', 'into', 'glucose', 'monosaccharides', 'during', 'digestion', '.']"
Answer,Is water a reactant or product of the reaction?,['Is water a reactant or product of the reaction?'],"['Is', 'water', 'a', 'reactant', 'or', 'product', 'of', 'the', 'reaction', '?']"
Answer,"Which chemical compounds block the 
\[3’\] end of a growing RNA strand?",['Which chemical compounds block the \r\n\\[3’\\] end of a growing RNA strand?'],"['Which', 'chemical', 'compounds', 'block', 'the', '\\', '[', '3', '’', '\\', ']', 'end', 'of', 'a', 'growing', 'RNA', 'strand', '?']"
Answer,"How can the carboxyl (
\[\text{--COOH}\]) terminus of a growing polypeptide chain be blocked? ",['How can the carboxyl (\r\n\\[\\text{--COOH}\\]) terminus of a growing polypeptide chain be blocked?'],"['How', 'can', 'the', 'carboxyl', '(', '\\', '[', '\\text', '{', '--', 'COOH', '}', '\\', ']', ')', 'terminus', 'of', 'a', 'growing', 'polypeptide', 'chain', 'be', 'blocked', '?']"
Answer,The covalent bonds between individual glucose monomers will not be cleaved.,['The covalent bonds between individual glucose monomers will not be cleaved.'],"['The', 'covalent', 'bonds', 'between', 'individual', 'glucose', 'monomers', 'will', 'not', 'be', 'cleaved', '.']"
Answer,"The tag should have an affinity to bind only free 
\[3’\] hydroxyl (
\[\text{--OH}\]) and 
\[5’\] phosphate (
\[\text{--PO}_4\]) functional groups.",['The tag should have an affinity to bind only free \r\n\\[3’\\] hydroxyl (\r\n\\[\\text{--OH}\\]) and \r\n\\[5’\\] phosphate (\r\n\\[\\text{--PO}_4\\]) functional groups.'],"['The', 'tag', 'should', 'have', 'an', 'affinity', 'to', 'bind', 'only', 'free', '\\', '[', '3', '’', '\\', ']', 'hydroxyl', '(', '\\', '[', '\\text', '{', '--', 'OH', '}', '\\', ']', ')', 'and', '\\', '[', '5', '’', '\\', ']', 'phosphate', '(', '\\', '[', '\\text', '{', '--', 'PO', '}', '_4\\', ']', ')', 'functional', 'groups', '.']"
Answer,Uracil nucleotides are present in the HIV genome. ,['Uracil nucleotides are present in the HIV genome.'],"['Uracil', 'nucleotides', 'are', 'present', 'in', 'the', 'HIV', 'genome', '.']"
Answer,The nucleotides of the virus contain uracil. ,['The nucleotides of the virus contain uracil.'],"['The', 'nucleotides', 'of', 'the', 'virus', 'contain', 'uracil', '.']"
Answer,"DNA is usually double-stranded, but RNA is usually single-stranded. 
","['DNA is usually double-stranded, but RNA is usually single-stranded.']","['DNA', 'is', 'usually', 'double-stranded', ',', 'but', 'RNA', 'is', 'usually', 'single-stranded', '.']"
Answer,Which nitrogenous bases are present in the structure of the informational polymer?,['Which nitrogenous bases are present in the structure of the informational polymer?'],"['Which', 'nitrogenous', 'bases', 'are', 'present', 'in', 'the', 'structure', 'of', 'the', 'informational', 'polymer', '?']"
Answer,Uracil nucleotides are not found in the cowpox genome.,['Uracil nucleotides are not found in the cowpox genome.'],"['Uracil', 'nucleotides', 'are', 'not', 'found', 'in', 'the', 'cowpox', 'genome', '.']"
Answer,"The nucleotides of the virus contain deoxyribose.",['The nucleotides of the virus contain deoxyribose.'],"['The', 'nucleotides', 'of', 'the', 'virus', 'contain', 'deoxyribose', '.']"
Answer,"The nucleotides of DNA and RNA contain a five-carbon sugar bonded to a phosphate group and a nitrogenous base.",['The nucleotides of DNA and RNA contain a five-carbon sugar bonded to a phosphate group and a nitrogenous base.'],"['The', 'nucleotides', 'of', 'DNA', 'and', 'RNA', 'contain', 'a', 'five-carbon', 'sugar', 'bonded', 'to', 'a', 'phosphate', 'group', 'and', 'a', 'nitrogenous', 'base', '.']"
Answer,Which five-carbon sugar is present in the structure of the informational polymer?,['Which five-carbon sugar is present in the structure of the informational polymer?'],"['Which', 'five-carbon', 'sugar', 'is', 'present', 'in', 'the', 'structure', 'of', 'the', 'informational', 'polymer', '?']"
Answer,60-70%,['60-70%'],"['60-70', '%']"
Answer,"A water molecule consists of two hydrogen atoms bonded to an oxygen atom, and its overall structure is bent. ","['A water molecule consists of two hydrogen atoms bonded to an oxygen atom, and its overall structure is bent.']","['A', 'water', 'molecule', 'consists', 'of', 'two', 'hydrogen', 'atoms', 'bonded', 'to', 'an', 'oxygen', 'atom', ',', 'and', 'its', 'overall', 'structure', 'is', 'bent', '.']"
Answer,Oxygen is more electronegative than hydrogen. ,['Oxygen is more electronegative than hydrogen.'],"['Oxygen', 'is', 'more', 'electronegative', 'than', 'hydrogen', '.']"
Answer,Weak interactions that form between a hydrogen with a partial positive charge and a more electronegative atom.,['Weak interactions that form between a hydrogen with a partial positive charge and a more electronegative atom.'],"['Weak', 'interactions', 'that', 'form', 'between', 'a', 'hydrogen', 'with', 'a', 'partial', 'positive', 'charge', 'and', 'a', 'more', 'electronegative', 'atom', '.']"
Answer,Water molecules are attracted to other polar molecules and to ions.,['Water molecules are attracted to other polar molecules and to ions.'],"['Water', 'molecules', 'are', 'attracted', 'to', 'other', 'polar', 'molecules', 'and', 'to', 'ions', '.']"
Answer,The attraction of molecules for other molecules of the same kind.,['The attraction of molecules for other molecules of the same kind.'],"['The', 'attraction', 'of', 'molecules', 'for', 'other', 'molecules', 'of', 'the', 'same', 'kind', '.']"
Answer,A phenomenon that results in the tendency of a liquid’s surface to resist rupture when placed under tension or stress.,['A phenomenon that results in the tendency of a liquid’s surface to resist rupture when placed under tension or stress.'],"['A', 'phenomenon', 'that', 'results', 'in', 'the', 'tendency', 'of', 'a', 'liquid', '’', 's', 'surface', 'to', 'resist', 'rupture', 'when', 'placed', 'under', 'tension', 'or', 'stress', '.']"
Answer,"Adhesion enables water to “climb” upwards through thin glass tubes (called capillary tubes) placed in a beaker of water. This upward motion against gravity, known as capillary action, depends on the attraction between water molecules and the glass walls of the tube (adhesion), as well as on interactions between water molecules (cohesion).","['Adhesion enables water to “climb” upwards through thin glass tubes (called capillary tubes) placed in a beaker of water.', 'This upward motion against gravity, known as capillary action, depends on the attraction between water molecules and the glass walls of the tube (adhesion), as well as on interactions between water molecules (cohesion).']","['Adhesion', 'enables', 'water', 'to', '“', 'climb', '”', 'upwards', 'through', 'thin', 'glass', 'tubes', '(', 'called', 'capillary', 'tubes', ')', 'placed', 'in', 'a', 'beaker', 'of', 'water', '.', 'This', 'upward', 'motion', 'against', 'gravity', ',', 'known', 'as', 'capillary', 'action', ',', 'depends', 'on', 'the', 'attraction', 'between', 'water', 'molecules', 'and', 'the', 'glass', 'walls', 'of', 'the', 'tube', '(', 'adhesion', ')', ',', 'as', 'well', 'as', 'on', 'interactions', 'between', 'water', 'molecules', '(', 'cohesion', ')', '.']"
Answer,The hydrogen bonds to break completely.,['The hydrogen bonds to break completely.'],"['The', 'hydrogen', 'bonds', 'to', 'break', 'completely', '.']"
Answer,Water molecules form a crystal structure maintained by hydrogen bonding.,['Water molecules form a crystal structure maintained by hydrogen bonding.'],"['Water', 'molecules', 'form', 'a', 'crystal', 'structure', 'maintained', 'by', 'hydrogen', 'bonding', '.']"
